{"schemaVersion":"5.0","siteMeta":{"title":"Serenity Wellness Studio | Johannesburg","description":"Professional massage, beauty and wellness treatments in Johannesburg."},"business":{"name":"Serenity Wellness Studio","shortName":"SERENITY","category":"Wellness Studio","tagline":"Relax. Restore. Renew.","description":"A professional wellness studio offering personalised massage, beauty and self-care treatments.","therapist":"Amina","currency":"R"},"contact":{"phone":"011 555 0101","whatsapp":"27815550101","email":"hello@serenitywellness.co.za","address":"12 Wellness Avenue","city":"Johannesburg","socials":{"facebook":"","instagram":"","tiktok":"","linkedin":""}},"navigation":{"home":"Home","services":"Services","pricing":"Pricing","shop":"Shop","blog":"Blog","booking":"Book"},"hours":{"enabled":true,"days":[{"day":"Monday \u2013 Friday","hours":"9:00 AM \u2013 6:00 PM"},{"day":"Saturday","hours":"9:00 AM \u2013 3:00 PM"},{"day":"Sunday","hours":"Closed"}]},"hero":{"eyebrow":"Wellness & Self-Care","headline":"RELAX, RESTORE, RENEW","description":"Professional treatments designed around your comfort, wellbeing and lifestyle.","buttonText":"BOOK AN APPOINTMENT","video":"","videoPoster":""},"highlights":{"eyebrow":"Featured Treatments","heading":"SPECIAL OFFERS & EXPERIENCES","description":"Discover signature treatments and personalised wellness experiences.","cards":[{"scriptTag":"Signature Care","title":"HOT STONE MASSAGE","buttonText":"LEARN MORE","description":"Deep relaxation and targeted tension release using warm stones.","image":""},{"scriptTag":"Wellness","title":"AROMATHERAPY RITUAL","buttonText":"LEARN MORE","description":"A calming treatment combining therapeutic touch with botanical oils.","image":""},{"scriptTag":"Beauty Care","title":"MANICURE & PEDICURE","buttonText":"LEARN MORE","description":"Complete hand and foot care for a polished, refreshed finish.","image":""}]},"services":[{"id":"s1","name":"HOT STONE MASSAGE","title":"HOT STONE MASSAGE","description":"Warm stones and therapeutic massage for deep relaxation.","price":650},{"id":"s2","name":"DEEP TISSUE MASSAGE","title":"DEEP TISSUE MASSAGE","description":"Firm, focused bodywork for persistent tension.","price":700},{"id":"s3","name":"AROMATHERAPY MASSAGE","title":"AROMATHERAPY MASSAGE","description":"Relaxing massage using selected essential oils.","price":650},{"id":"s4","name":"MANICURE & PEDICURE","title":"MANICURE & PEDICURE","description":"Complete nail grooming and foot care.","price":420}],"beautyServices":[{"id":"b1","name":"BROW SHAPING","price":120,"duration":"20 min","description":"Precision brow shaping.","category":"threading"}],"packages":[{"id":"p1","title":"RELAXATION PACKAGE","duration":"90 min","price":850,"recommended":true,"services":["Massage","Aromatherapy"],"description":"A complete relaxation experience."}],"pricingSection":{"eyebrow":"Exclusive Wellness","heading":"TREATMENTS & PRICING","description":"Choose a treatment that fits your needs and let us tailor the experience for you.","imageTitle":"Wellness & Relaxation","ctaText":"BOOK YOUR SESSION"},"pricingHighlights":[{"title":"PERSONALISED","description":"Treatments tailored to you."},{"title":"PROFESSIONAL","description":"Experienced wellness care."},{"title":"CONVENIENT","description":"Easy appointment booking."}],"trust":{"heading":"YOUR WELLNESS, OUR PASSION \u2665","description":"Professional care designed around your comfort."},"callout":{"eyebrow":"SCHEDULE & VISITS","heading":"OPEN HOURS & LOCATION","description":"Visit us for personalised wellness and beauty treatments.","location":"Johannesburg","hoursHeading":"Open Hours","hoursText":"Monday \u2013 Friday: 9 AM \u2013 6 PM","primaryAction":"BOOK APPOINTMENT","secondaryAction":"EXPLORE","retreatEyebrow":"Your Wellness Destination","retreatHeading":"PERSONALISED CARE & ATTENTION","healingEyebrow":"Personalised Healing","healingHeading":"TREATMENTS TAILORED TO YOU"},"blog":{"enabled":true,"eyebrow":"Wellness & Self-Care","heading":"WELLNESS & HEALTH INSIGHTS","description":"Useful wellness articles and self-care guidance.","articles":[{"id":1,"category":"MASSAGE THERAPY","title":"THE BENEFITS OF REGULAR MASSAGE","dateAuthor":"2026 \u2022 Wellness Studio"},{"id":2,"category":"HOLISTIC WELLNESS","title":"HOW TO BUILD A WELLNESS ROUTINE","dateAuthor":"2026 \u2022 Wellness Studio"},{"id":3,"category":"BEAUTY CARE","title":"SIMPLE SELF-CARE FOR BUSY DAYS","dateAuthor":"2026 \u2022 Wellness Studio"},{"id":4,"category":"WELLNESS TIPS","title":"RESTORE YOUR ENERGY NATURALLY","dateAuthor":"2026 \u2022 Wellness Studio"}]},"products":{"enabled":true,"eyebrow":"Wellness & Home Care","heading":"SELF-CARE PRODUCTS","description":"Take the wellness experience home.","items":[{"id":1,"category":"BODY CARE","title":"BODY OIL","price":"R250.00"},{"id":2,"category":"SOOTHING CARE","title":"ALOE VERA GEL","price":"R180.00"},{"id":3,"category":"HERBAL","title":"HERBAL BALM","price":"R220.00"},{"id":4,"category":"NAIL CARE","title":"CUTICLE OIL","price":"R150.00"}]},"booking":{"enabled":true,"heading":"BOOK YOUR WELLNESS EXPERIENCE","description":"Tell us what you need and we will confirm your appointment.","whatsappBooking":true,"whatsappNumber":"27815550101","calloutFee":0},"cart":{"enabled":true,"whatsappNumber":"27815550101"},"footer":{"about":"Professional wellness, massage and beauty treatments created around your comfort and wellbeing.","hoursHeading":"OPEN HOURS","contactHeading":"CONTACTS","newsletterText":"Join our newsletter for wellness updates and special offers.","newsletterHeading":"NEWSLETTER & UPDATES","therapistName":"Amina","legal":{"privacyText":"Privacy Policy","privacyUrl":"","termsText":"Terms of Use","termsUrl":""}}}